{
  "version": "4.0",
  "category": "decode",
  "description": "Primitive value decoding – strings, numbers, booleans, null, unescaping",
  "tests": [
    {
      "name": "parses safe unquoted string",
      "input": "hello",
      "expected": "hello",
      "specSection": "7.4"
    },
    {
      "name": "parses empty quoted string",
      "input": "\"\"",
      "expected": "",
      "specSection": "4"
    },
    {
      "name": "parses quoted strings with newline, tab, and carriage return escapes",
      "input": "[3]: \"line1\\nline2\",\"tab\\there\",\"return\\rcarriage\"",
      "expected": ["line1\nline2", "tab\there", "return\rcarriage"],
      "specSection": "7.1"
    },
    {
      "name": "parses quoted string with backslash escape",
      "input": "\"C:\\\\Users\\\\path\"",
      "expected": "C:\\Users\\path",
      "specSection": "7.1"
    },
    {
      "name": "parses quoted string with escaped quotes",
      "input": "\"say \\\"hello\\\"\"",
      "expected": "say \"hello\"",
      "specSection": "7.1"
    },
    {
      "name": "decodes \\uXXXX escape (U+0004)",
      "input": "val: \"a\\u0004b\"",
      "expected": { "val": "a\u0004b" },
      "specSection": "7.1"
    },
    {
      "name": "decodes \\uXXXX with mixed-case hex digits",
      "input": "val: \"a\\u00Abb\"",
      "expected": { "val": "a«b" },
      "specSection": "7.1"
    },
    {
      "name": "parses Unicode string",
      "input": "caf\u00e9",
      "expected": "caf\u00e9",
      "specSection": "16"
    },
    {
      "name": "parses Chinese characters",
      "input": "你好",
      "expected": "你好",
      "specSection": "16"
    },
    {
      "name": "parses string with emoji and spaces",
      "input": "hello 👋 world",
      "expected": "hello 👋 world",
      "specSection": "16"
    },
    {
      "name": "parses positive integer",
      "input": "42",
      "expected": 42,
      "specSection": "4"
    },
    {
      "name": "parses decimal number",
      "input": "3.14",
      "expected": 3.14,
      "specSection": "4"
    },
    {
      "name": "parses negative integer",
      "input": "-7",
      "expected": -7,
      "specSection": "4"
    },
    {
      "name": "parses true",
      "input": "true",
      "expected": true,
      "specSection": "4"
    },
    {
      "name": "parses false",
      "input": "false",
      "expected": false,
      "specSection": "4"
    },
    {
      "name": "parses null",
      "input": "null",
      "expected": null,
      "specSection": "4"
    },
    {
      "name": "respects ambiguity quoting for true",
      "input": "\"true\"",
      "expected": "true",
      "specSection": "4"
    },
    {
      "name": "respects ambiguity quoting for integer",
      "input": "\"42\"",
      "expected": "42",
      "specSection": "4"
    },
    {
      "name": "decodes supplementary scalar (U+1F680) in quoted string as literal UTF-8",
      "input": "\"🚀 launch\"",
      "expected": "🚀 launch",
      "specSection": "7.1"
    },
    {
      "name": "decodes a raw control character inside a quoted string",
      "input": "val: \"x\u0001y\"",
      "expected": {
        "val": "x\u0001y"
      },
      "specSection": "7.1",
      "minSpecVersion": "4.2"
    }
  ]
}
