{
  "version": "4.0",
  "category": "decode",
  "description": "Root form detection – empty document, single primitive, literal empty array",
  "tests": [
    {
      "name": "parses empty document as empty object",
      "input": "",
      "expected": {},
      "options": {
        "strict": true
      },
      "specSection": "5"
    },
    {
      "name": "parses literal [] at root as empty array",
      "input": "[]",
      "expected": [],
      "options": {
        "strict": true
      },
      "specSection": "5"
    },
    {
      "name": "throws on trailing content after a root array",
      "input": "[2]: 1,2\njunk: 3",
      "expected": null,
      "shouldError": true,
      "options": {
        "strict": true
      },
      "specSection": "5",
      "note": "The root form spans the whole document; trailing lines must not be silently discarded"
    },
    {
      "name": "throws on trailing content after a keyed tabular root",
      "input": "[2:]{v}:\n  a: 1\n  b: 2\njunk: 3",
      "expected": null,
      "shouldError": true,
      "options": {
        "strict": true
      },
      "specSection": "5"
    },
    {
      "name": "throws on trailing content after a root empty array",
      "input": "[]\njunk: 3",
      "expected": null,
      "shouldError": true,
      "options": {
        "strict": true
      },
      "specSection": "5"
    },
    {
      "name": "parses a root primitive after a leading blank line",
      "input": "\nhello",
      "expected": "hello",
      "options": {
        "strict": true
      },
      "specSection": "5"
    },
    {
      "name": "throws on a trailing bare token after a root array in non-strict mode",
      "input": "[2]: 1,2\njunk",
      "expected": null,
      "shouldError": true,
      "options": {
        "strict": false
      },
      "specSection": "5",
      "note": "The non-strict leniency for trailing content excludes scalar lines (§5.2)",
      "minSpecVersion": "4.1"
    },
    {
      "name": "parses a root line shaped like a header without a colon as a string",
      "input": "items[2]",
      "expected": "items[2]",
      "specSection": "6",
      "minSpecVersion": "4.2"
    },
    {
      "name": "throws on an indented root primitive in non-strict mode",
      "input": "  hello",
      "expected": null,
      "shouldError": true,
      "options": {
        "strict": false
      },
      "specSection": "5",
      "note": "The non-strict skip for over-indented lines excludes scalar lines (§5.2)",
      "minSpecVersion": "4.2"
    },
    {
      "name": "parses a root primitive whose colon follows an unclosed quote",
      "input": "a\"b: 1",
      "expected": "a\"b: 1",
      "specSection": "5.2",
      "minSpecVersion": "4.2"
    },
    {
      "name": "throws on a scalar line after a skipped over-indented first line in non-strict mode",
      "input": "  a: 1\nhello",
      "expected": null,
      "shouldError": true,
      "options": {
        "strict": false
      },
      "specSection": "5",
      "minSpecVersion": "4.2"
    }
  ]
}
