{
  "version": "4.0",
  "category": "decode",
  "description": "Number decoding edge cases – trailing zeros, exponent forms, negative zero",
  "tests": [
    {
      "name": "parses number with trailing zeros in fractional part",
      "input": "value: 1.5000",
      "expected": {
        "value": 1.5
      },
      "specSection": "4"
    },
    {
      "name": "parses exponent forms in either case with optional exponent sign",
      "input": "a: -1E+03\nb: 2.5e2\nc: 3E-02",
      "expected": {
        "a": -1000,
        "b": 250,
        "c": 0.03
      },
      "specSection": "4"
    },
    {
      "name": "parses negative zero as zero",
      "input": "a: -0\nb: -0.0",
      "expected": {
        "a": 0,
        "b": 0
      },
      "specSection": "4",
      "note": "Most host environments do not distinguish -0 from 0"
    },
    {
      "name": "parses array with mixed numeric forms",
      "input": "nums[5]: 42,-1E+03,1.5000,-0,2.5e2",
      "expected": {
        "nums": [42, -1000, 1.5, 0, 250]
      },
      "specSection": "4"
    },
    {
      "name": "treats leading zero as string not number",
      "input": "value: 05",
      "expected": {
        "value": "05"
      },
      "specSection": "4"
    },
    {
      "name": "parses zero with exponent as number",
      "input": "value: 0e1",
      "expected": {
        "value": 0
      },
      "specSection": "4"
    },
    {
      "name": "parses exponent notation",
      "input": "1e6",
      "expected": 1000000,
      "specSection": "4"
    },
    {
      "name": "treats unquoted leading-zero number as string",
      "input": "05",
      "expected": "05",
      "specSection": "4"
    },
    {
      "name": "treats leading-zeros in array as strings",
      "input": "nums[3]: 05,007,0123",
      "expected": { "nums": ["05", "007", "0123"] },
      "specSection": "4"
    },
    {
      "name": "treats unquoted negative leading-zero number as string",
      "input": "-05",
      "expected": "-05",
      "specSection": "4"
    },
    {
      "name": "treats bare-fraction, trailing-dot, and leading-plus tokens as strings",
      "input": "a: .5\nb: 1.\nc: +1",
      "expected": {
        "a": ".5",
        "b": "1.",
        "c": "+1"
      },
      "specSection": "4",
      "note": "Outside the number grammar, so a host number parser would corrupt the round-trip"
    },
    {
      "name": "treats leading-plus tokens in array as strings",
      "input": "values[3]: +1,+1.5,+1e2",
      "expected": {
        "values": ["+1", "+1.5", "+1e2"]
      },
      "specSection": "4",
      "note": "The grammar admits only an optional leading minus, so leading-plus cells stay strings"
    },
    {
      "name": "treats Infinity and NaN tokens as strings",
      "input": "a: Infinity\nb: -Infinity\nc: NaN",
      "expected": {
        "a": "Infinity",
        "b": "-Infinity",
        "c": "NaN"
      },
      "specSection": "4"
    },
    {
      "name": "treats hex and underscore-separated tokens as strings",
      "input": "a: 0x10\nb: 1_000",
      "expected": {
        "a": "0x10",
        "b": "1_000"
      },
      "specSection": "4",
      "note": "Host parsers that accept these forms have a wider grammar than the spec permits"
    },
    {
      "name": "treats non-ASCII digits as a string",
      "input": "value: ٤٢",
      "expected": {
        "value": "٤٢"
      },
      "specSection": "4"
    }
  ]
}
